Page,Summary
Page 1," Course: The NUS Confidential Course is based at the University of Cambridge . The course is based in Cambridge, Cambridge, London and New York . The syllabus is based on a four-month course ."
Page 2," The Graduate Certificate in Intelligent Robotic Systems (s) is offered at the University of Manchester . Exam dates may be subjected to changes due to unforeseen circumstances, if applicable ."
Page 3, The NUS Confidential Course is based at the University of Sydney . The syllabus has been updated as of 19/3/2025 . The course is based in Sydney and Melbourne .
Page 4, Examination period for AY2025/2026 Semester 1 is tentatively scheduled for 2nd week of November 2025 . Examination period may be subjected to changes .
Overall Summary," The Graduate Certificate in Intelligent Sensing Systems (s) and Robotic Systems (SWE5003) Exam dates may be subjected to changes due to unforeseen circumstances, if applicable ."
