Page Number,Summary
54,"4

The SETR-MLA decoder design involves a transformer block with input image dimensions of H x W x 3. The 24-th layer output is reshaped and combined with the 18-th, 12-th, and 6-th layer outputs through a series of 1x1 and 3x3 convolutions. This is followed by four up-sampling layers and a final 1x1 convolution to produce a feature map with dimensions H/4 x W/4 x C, where C=1024 for the SETR-MLA model. The feature map is then concatenated with a multi-level feature aggregation (MLA) and used as input for the final 1x1 convolutional layer to produce"
55,"The decoder design for the SegFormer vision system consists of four transformer blocks, with each block having a different size and number of channels. The input image is passed through four 1x1 convolution layers before being concatenated with the output of the transformer blocks. The concatenated output is then upsampled and passed through another 1x1 convolution layer. This design is based on the SegFormer model, which uses transformers for efficient semantic segmentation. The number of object classes is determined by the last layer's number of channels."
56,"The meta architecture for detection and segmentation using deep learning with transformers consists of several key components: a backbone network, which extracts features from the input image; a neck network, which further refines the features; an object query mechanism, which assigns a query vector to each potential object in the image; a decoder network, which uses the query vectors to generate object-specific features; and a mask output network, which produces the final segmentation mask for each object. This architecture is described in more detail in the referenced paper."
57,"The Safe Distance @ Parks program implemented by National Parks in Singapore has eliminated the need for staff to manually count crowds, allowing them to focus on other tasks and engage with the public. A web portal has been created to provide the public with visibility of park crowd conditions for self-management. This program has been successful in improving efficiency and promoting self-regulation in park visitors."
58,"The objective of this challenge is to use deep learning techniques, specifically transformers, to track the amount of food and beverage wastage on flights. This will help collect data on passengers' consumption patterns more efficiently. The challenge is hosted by Singapore Airlines and the National University of Singapore."
59,"This page discusses future developments in the use of deep learning and transformer-based technology for building vision systems. Specifically, it mentions the potential for using computer vision to detect missing barricades and the possibility of automation in construction by November 2021. These advancements are being developed by the National University of Singapore and are expected to improve the accuracy and efficiency of building vision systems."
60,"The document discusses the future direction of S-VSE, a building vision system that uses deep learning with transformers. It mentions the development of a block progress monitoring feature, which will use image segmentation to track the progress of construction. This feature will be useful for construction companies and project managers to monitor and manage their projects more efficiently."
61,"The next step in building vision systems using deep learning is crowd counting, which can be done through detection-based methods, regression-based methods, or density estimation-based methods. Detection-based methods involve identifying people in an image and counting them, while regression-based methods involve extracting low level features from cropped patches of the image. Density estimation-based methods create a density map for objects and then use an algorithm to learn a mapping between the extracted features and their object density maps. A useful reference for this topic is ""CNN-based Density Estimation and Crowd Counting: A Survey."""
62,"The document discusses the use of deep learning (specifically transformer-based models) for building vision systems. It mentions the next steps for this technology, specifically in the area of crowd counting. This includes evaluating the performance of the counting by looking at the image-level, pixel-level, and point-level. The document also mentions the use of manual annotation for human heads in order to calculate density maps."
63,"The page discusses the future direction of open-world detection in vision systems using deep learning with transformers. It references a paper on simple open-vocabulary object detection with vision transformers, which will be presented at ECCV 2022. This approach aims to improve the ability of vision systems to detect and classify objects in open-world scenarios where new objects may appear that were not seen during training."
64,"The document discusses the use of deep learning with transformer-based models in building vision systems. It is the second version of the S-VSE (Simplified Vision System Engineering) and is copyrighted by the National University of Singapore. The author, Dr. Tian Jing, can be contacted via email for further information."
