Page Number,Summary
52,"This section discusses the use of multiple classifiers in text categorization. It presents a table showing the results of running two classifiers on a set of documents, and explores various methods for aggregating the results, such as union, intersection, algorithmic, voting, and by confidence level. The section also mentions the creation of lists of predicted documents, with a table showing the results of one such list."
53,"This section discusses various real-world applications of text categorization, including email spam filtering, sentiment analysis, and topic classification. It highlights the importance of accurately categorizing text for these tasks and the challenges involved, such as dealing with large datasets and noisy data. The use of machine learning algorithms and techniques for feature selection is also mentioned. Overall, text categorization has a wide range of practical applications and continues to be an active area of research."
54,"The video discusses the use of boosting algorithms in identifying fraudulent insurance claims. Boosting is a machine learning technique that combines multiple weak classifiers to create a stronger classifier. In the context of fraud detection, boosting can help improve the accuracy of identifying fraudulent claims by considering various features and patterns in the data. The video also highlights the challenges in identifying fraudulent claims, such as the constantly evolving methods used by fraudsters and the imbalance of fraudulent vs. legitimate claims in the data. Overall, boosting algorithms have shown promising results in detecting fraudulent claims and can be a valuable tool for insurance companies in preventing fraud."
55,"”


Page 55 of the document discusses unsupervised text categorization, which is a method of automatically assigning categories to text documents without the use of predefined categories or training data. This approach involves using statistical techniques such as clustering and dimensionality reduction to group similar documents together and identify common themes. It also mentions the challenges of this method, such as the need for large amounts of data and the potential for misclassification. Overall, unsupervised text categorization can be a useful tool for organizing and analyzing large volumes of text data."
56,"=


Document clustering is a technique used to group similar documents together based on their content. It involves analyzing the features of each document and finding patterns to determine which documents are related. This can be done through various methods such as vector space models, hierarchical clustering, and probabilistic clustering. Document clustering has various applications, such as organizing large document collections, information retrieval, and text summarization. It can also be used to identify hidden relationships between documents and to improve the efficiency of text categorization. However, it can be challenging due to the subjective nature of document similarity and the need for appropriate feature selection."
57,"Text clustering is the process of grouping documents together based on their similarity. This allows for better exploration and understanding of data, as it reveals groupings, sizes, common terms, and anomalies within the data. Many tools for text clustering are interactive, making it easier to analyze and interpret the data."
58,The video discusses an example of text categorization using clustering. The process involves grouping similar documents together based on their content and using algorithms to determine the most relevant categories for each document. This can be useful for organizing large amounts of text data and identifying patterns and trends. The video also explains the importance of choosing appropriate features and evaluating the performance of the clustering algorithm.
59,"The video discusses the use of patent clustering in text categorization. Patent clustering involves grouping patents together based on their similarity in language and content. This method can help identify patterns and trends in patents and aid in patent search and analysis. It also allows for the creation of patent landscapes, which can help companies understand their competitors and potential areas for innovation. The video highlights the importance of using advanced techniques, such as natural language processing and machine learning, to improve the accuracy and efficiency of patent clustering."
60,"The notes about clustering emphasize that clusters may contain unexpected documents and that it is important to drill down into these surprising clusters. The number of clusters can be controlled, but it is important to avoid having too many (overfitting) or too few (meaningless) clusters. The clusters should lead to meaningful business outcomes. Clustering does not require a training phase and can be applied to multiple languages, but it is limited to one language at a time."
61,"FOR TEXT CATEGORIZATION_


The process of dimensional reduction is used in text categorization to reduce the number of features or dimensions in a dataset. This is important because high-dimensional datasets can lead to overfitting and decreased performance of classification models. Dimensional reduction methods such as Principal Component Analysis (PCA) and Latent Semantic Analysis (LSA) are commonly used to reduce the number of features while preserving the important information in the data. These methods can also help in visualizing the data and identifying patterns. However, the choice of dimensional reduction method should be based on the characteristics of the dataset and the goals of the text categorization task."
62,"Dimensional reduction is a technique used in text categorization to reduce the number of features or dimensions in a dataset. This is necessary because text data is often sparse and high-dimensional, making it difficult to process and analyze. One method of dimensional reduction is singular value decomposition (SVD), which transforms the data into a lower-dimensional space while preserving the most important information. This helps to improve the efficiency and accuracy of text categorization algorithms."
63,"Singular Value Decomposition (SVD) is a method used for data dimensionality reduction in text categorization. It involves decomposing a matrix into three components: U, V, and Σ. The columns of U and V are orthogonal and unit vectors, while the entries of Σ (singular values) are positive and arranged in descending order of importance. This allows for the identification of the most significant features in the data and can help improve the performance of text categorization algorithms."
64,"Singular Value Decomposition is a mathematical technique used to reduce the dimensionality of data by identifying the most important features. The top two dimensions, 3 and 11, are selected for further analysis. The resulting matrix is then sorted by the singular values, with the highest value being [REDACTED_PHONE]."
65,"Singular Value Decomposition is a mathematical technique used to reduce the dimensions of a matrix. In this case, it has reduced the dimensions from 11 to 2. The resulting matrix has been sorted and the top two singular values are [REDACTED_PHONE] and 3,N."
66,"To reduce the dimensionality of data points, SVD/PCA is applied, resulting in SVDs/Concepts. These concepts are then used in classifiers such as KM to create clusters. This process reduces the dimensions from 11 to 2, with each concept/SVD corresponding to a cluster. The singular values are sorted and used to identify the most important features in the data."
67,"Singular Value Decomposition (SVD) is a technique used in text categorization to reduce the dimensionality of a term-document matrix (TDM). Typically, only 5 to 20 dimensions are needed to capture most of the information from the TDM. However, if the data is being used for predictive modeling or clustering, a few hundred dimensions can be retained. Figure 11.3 shows a plot of relative squared singular values against the number of latent semantic dimensions. This information is from the book ""Practical Text Mining and Statistical Analysis for Non-structured Text data""."
68,"The automatic categorization of documents is the process of using computer algorithms to classify documents into different categories based on their content. This process involves analyzing the text and identifying key features, such as keywords and topic clusters, to determine the appropriate category for the document. This method has become increasingly important in managing large amounts of digital information and improving search and retrieval processes. However, it can be challenging due to the complexity and variability of language and the need for constantly updating and refining the algorithms."
69,"Topic modeling is a type of text categorization that involves identifying and extracting the main topics or themes present in a large collection of documents. It is often used in natural language processing and machine learning to help understand and organize large amounts of text data. The key steps in topic modeling include data preprocessing, creating a document-term matrix, selecting a suitable algorithm, and evaluating the results. The most commonly used algorithm for topic modeling is Latent Dirichlet Allocation (LDA), which uses a statistical approach to identify topics based on the co-occurrence of words in documents. Topic modeling can be useful for tasks such as document clustering, text summarization, and information retrieval. It can also be combined with other techniques, such as sentiment analysis, to"
70,"Supervised categorization involves using labeled data to train a model that can accurately categorize new, unlabeled data. Unsupervised categorization, on the other hand, does not use labeled data and instead relies on identifying patterns and similarities in the data to categorize it. Both approaches involve input variables that can affect the observed outputs, but in supervised categorization these variables are known and in unsupervised categorization they may not be observable. Both approaches use causal relationships to categorize data."
71,"In Example 71, the focus is on actors and their movies as observed inputs. The potential tags of ""Action"" and ""War"" are considered to be latent variables, meaning they are not directly observed but can be inferred from the data. This highlights the use of text categorization to identify and classify relevant information."
72,"The text provides a list of dates, amounts, and locations, with a few anomalies such as a low amount in Kiev and a high amount in Johor. The focus of this section is on anomaly detection, which is the process of identifying unusual or abnormal data points in a dataset. This can be useful for detecting fraudulent or erroneous data."
73,"Topic modeling is a method of identifying and organizing the underlying themes or discourses present in a collection of documents. These discourses are represented by groups of words that are commonly found together, such as ""dog"" and ""bark"" or ""pilot"" and ""plane"". By identifying these topics, researchers can gain a better understanding of the content of the documents and potentially uncover new insights."
74,"The animation of topic modeling is represented by columns for documents, rows for words, and squares for frequency, with darker squares indicating higher frequency. The grouping of documents is based on the use of similar words, resulting in a set of words that can be considered as ""topics"". The number of groups is predetermined. This process can be viewed at http://topicmodels.west.uni-koblenz.de/ckling/tmt/svd_ap.html."
75,"LDA (Latent Dirichlet Allocation) is a statistical model used for text categorization, which identifies hidden topics in a collection of documents and assigns them to each document based on the distribution of words. It assumes that each document contains a mixture of different topics and that each topic is represented by a distribution of words. The model uses probability to determine the likelihood of a document belonging to a particular topic. LDA is useful for organizing large amounts of text data and can be applied to various tasks such as document clustering, topic extraction, and information retrieval."
76,"The document discusses various applications of text categorization, including diachronic analysis and contrast analysis. Diachronic analysis involves analyzing texts over a period of time, such as speeches during an election campaign and speeches after taking office. Contrast analysis focuses on comparing different candidates' positions and issues, as well as examining the characteristics of various media publications. These applications demonstrate the usefulness of text categorization in understanding and analyzing large amounts of text data."
77,The topic modeling process involves inputting a predefined number of topics and using a term-document matrix (TDM) to determine the distribution of words among topics. This is represented by a word-topic distribution and a doc-topic distribution. The topics are indexed with numbers and are represented by a list of important words.
78,"The document provides a list of resources and references for further reading on automated text categorization. These include tutorials, books, and online resources from experts in the field such as Fabrizio Sebastiani, F. Aiolli, John Elder, Gary Miner, Bob Nisbet, Chris Manning, Hinrich Schutze, Scott Weingart, and Ted Underwood. It also includes a link to the NLP resources page from Stanford University. These resources cover a range of topics related to text categorization, including statistical natural language processing and topic modeling."
