Page Number,Summary
1,".

Module 6 of the Text Analytics course covers text categorization, which is the process of automatically assigning text documents to predefined categories based on their content. The module will be taught by Dr. Wang Aobo, whose email address is provided."
2,"This module aims to help readers understand the concept of text categorization and how it functions, as well as how to assess its effectiveness in a business scenario. It covers both supervised and unsupervised text categorization methods and introduces the concept of topic modeling. By the end of this module, readers will have a better understanding of text categorization and its applications."
3,"The document discusses the use of deep learning libraries such as Transformers, BERT, T5, GPT, and LLMs for pre-training and fine-tuning in text categorization. These libraries offer powerful tools for natural language processing tasks and have been shown to achieve high levels of accuracy in various text classification tasks. They use pre-training and fine-tuning techniques to improve their performance on specific tasks, and have been widely adopted in the field of text categorization. These libraries are constantly evolving and being updated, making them valuable resources for text classification tasks."
4,"This module provides an outline for learning about text categorization, including its definition and how supervised text categorization works. It also covers topics such as building a classifier, evaluating its performance through a quiz, and running the classifier in a workshop setting. The module also includes examples of text categorization applications and discusses unsupervised methods such as document clustering and topic modeling, with a workshop on Latent Dirichlet Allocation (LDA)."
5,"Text categorization is the process of automatically assigning text documents to predefined categories based on their content. It involves using machine learning algorithms to analyze the text and identify patterns that can be used to classify it. This technique is commonly used in tasks such as sentiment analysis, spam detection, and topic classification. Text categorization can be applied to various types of text data, including emails, social media posts, news articles, and product reviews. It offers benefits such as efficiency, consistency, and scalability in handling large volumes of text data."
6,"The document discusses the contrast between a library catalog and a text categorization system. It provides an example of a subject, statistics, and explains that in a library catalog, this subject would be assigned by a cataloger, which can be a slow and tedious process and may result in inconsistencies."
7,The MESH index is a tool used to categorize journal papers based on their subject matter. It consists of a set of terms and codes that can be used to identify the main topics and subtopics covered in a paper. This index is maintained by the University of Ulster and can be accessed online. It is helpful for researchers and readers to quickly identify relevant papers on a specific topic.
8,"Text categorization, also known as classification, is the process of assigning text documents into specific categories. There are two types of classification: hard and soft. In hard classification, a document can only be assigned to one category, such as in spam filtering where it is classified as either ""spam"" or ""not spam."" In soft classification, a document can have multiple category labels, as is the case with news filtering where articles can be categorized by subject, news section, or geographical location."
9,"Text classification is the process of assigning categories to documents, and it has various applications such as email spam detection, medical diagnosis, language identification, fraud detection, sentiment analysis, and news monitoring."
10,"Automatic text categorization is a process that involves analyzing and categorizing large amounts of text data using machine learning algorithms. The key steps in this process include preprocessing the text, feature extraction, selecting a classification algorithm, and evaluating the performance of the model. Preprocessing involves cleaning and formatting the text data, while feature extraction involves identifying important words and phrases that can be used to classify the text. The classification algorithm then uses these features to assign categories to the text. The performance of the model can be evaluated using metrics such as accuracy, precision, and recall. Overall, automatic text categorization is an efficient and accurate way to organize and classify large volumes of text data."
11,"The supervised method of text categorization involves two phases: training and running. In the training phase, a set of categorized documents is divided into training and testing sets. The classifier is then trained on the training set to accurately categorize the documents. The level of accuracy depends on the difficulty of the task. In the running phase, the classifier is used on new sets of documents, but occasional auditing is necessary to ensure accuracy. This can be done by assessing a random sample of documents against the predicted categories."
12,"Page 12 of the document 'S06_Text_Categorization_V3.6.pdf' discusses the document data set used for text categorization. The data set includes a collection of documents from various sources, such as news articles, emails, and web pages. The documents are categorized into 20 different topics, including politics, sports, and technology. The data set also includes a training set and a test set, with the training set used to train the categorization model and the test set used to evaluate its performance. The document data set is widely used in text categorization research and provides a diverse and challenging set of documents for training and testing text categorization algorithms."
13,"The article discusses the classification of movie reviews as either written by a human or a robot. The author presents a dataset of 50,000 movie reviews, half of which were written by humans and the other half by robots. The reviews were classified using a machine learning algorithm and the results showed that the algorithm was able to accurately distinguish between human and robot-written reviews with an accuracy of 91.5%. The author also discusses the potential implications of this classification, such as identifying fake reviews or determining the impact of human versus robot opinions on movie ratings."
14,"The document discusses the classification of movie reviews as either ""Human"" or ""Robot"" based on the source of the review. A dataset of 5000 reviews was used, with 70% of the reviews being used for training and 30% for testing. The goal is to accurately classify reviews as being written by a human or a robot."
15,"The process of building a classifier involves selecting features, choosing a classification algorithm, and evaluating the performance of the classifier. Some common examples of classification algorithms include Naive Bayes, Support Vector Machines, and Decision Trees. Feature selection is important and can be done manually or automatically using techniques such as information gain or chi-square. The performance of a classifier can be evaluated using metrics such as accuracy, precision, and recall. Other considerations for building a classifier include data preprocessing, handling imbalanced data, and handling missing values."
16,"The traditional method of creating classifiers involved hand-coding, which was a time-consuming process. This approach involved using logical statements in disjunctive normal form to define conditions for categorizing text. However, with the advancement of technology, machine learning algorithms have become more popular for creating classifiers. These algorithms can automatically learn patterns and make predictions based on training data, making the process more efficient and accurate."
17,"The Naïve Bayes Model is a type of generative classifier used in document classification. It calculates the probability of event A, given that event B (also known as observations) is true. In the context of document classification, A and B refer to the categories or labels of the documents and the words or features within the documents, respectively."
18,"The Naïve Bayes model is a probabilistic classifier that calculates the probability of a document belonging to a certain category by multiplying the probability of the category and the probability of the document given that category. This can be represented as P(cj|di) = P(cj)P(di|cj) / P(di). The model assumes that the features of the document are independent of each other, which allows for simplified calculations. This model is often used in text categorization tasks."
19,"The Naïve Bayes model is a popular classification algorithm that uses the Bayes theorem to assign documents to categories. It calculates the probability of a document belonging to a certain category by multiplying the likelihood of each word in the document with the prior probability of that category. For example, in sentiment detection, the model would calculate the likelihood of a word appearing in positive or negative documents and the prior probability of a document being positive or negative. During testing, the model compares the results and assigns the document to the category with the higher probability."
20,"The Naïve Bayes model is a popular method for text categorization, where the probability of a document belonging to a certain class is calculated based on the probabilities of the individual words in the document. In sentiment detection, for example, the model would calculate the likelihood of a document being positive or negative based on the probabilities of the words in that document. During training, the model calculates and stores the likelihood of vocabulary words for each class. During testing, it compares the likelihoods and assigns the document to the class with the highest result. An example of this process is shown, where the document ""I love my cat"" would have a higher likelihood of belonging to the positive class, while ""I hate my cat"" would have a higher"
21,"The document discusses the use of discriminative classifiers, specifically decision tree classifiers, in text categorization. It provides a list of girls' and boys' names as an example of how decision trees work. The leaf node contains the final classification decision, while the internal node contains the feature used for splitting the data."
22,"The decision tree in this example is used to categorize names as either male or female. The tree is built using features such as the last letter of the name, the presence of certain letters or combinations of letters, and the length of the name. The tree is trained on a dataset of names and their corresponding genders. The decision tree is then used to predict the gender of new names based on these features. This method can be applied to other text categorization tasks as well."
23,"The document provides an example of a decision tree used to determine if a name is male or female. The tree considers factors such as the last letter being a vowel, the first letter being ""k"", the last letter being ""t"", and the last letter being ""o"". The names Fanny, Kate, and Howard are used as examples to demonstrate how the tree would classify them as female, female, and male, respectively."
24,"The document discusses the ATA/S-TA/Text Categorization/V3.0 system, which is used for automated text categorization. This system is based on a combination of machine learning algorithms and human-defined rules to accurately categorize large amounts of text data. It has been developed by the National University of Singapore and is protected by copyright."
25,"The Rocchio Classifier is a type of discriminative classifier that uses prototypical documents, or profile vectors, to represent each category. Documents are then classified by comparing their similarity to the profile vector of each category. This method is commonly used in text categorization and is based on the vector space model."
26,Support Vector Machines (SVMs) are a type of discriminative classifier that uses hyperplanes to separate positive and negative training samples in the term space. The goal is to select the surface that provides the widest separation between the support surfaces.
27,"The evaluation of text categorization systems is crucial for assessing their performance and effectiveness. The most common measures used for evaluation include accuracy, precision, recall, and F-measure. These measures are calculated by comparing the predicted categories to the actual categories of a set of test documents. Other factors that should be considered in evaluation include the size and diversity of the training and test data, the presence of class imbalances, and the use of cross-validation techniques. It is also important to establish a baseline performance for comparison and to consider the specific goals and requirements of the text categorization task."
28,"The accuracy of a text categorization system can be evaluated by comparing the predicted categories to the actual categories of a set of documents. This can be done using metrics such as precision, recall, and F1 score. Precision measures the proportion of correctly predicted categories out of all predicted categories, while recall measures the proportion of correctly predicted categories out of all actual categories. The F1 score is a combination of precision and recall, and a higher score indicates a more accurate system. Other measures, such as confusion matrix and receiver operating characteristic (ROC) curve, can also be used for evaluation. It is important to use a diverse and representative dataset for accurate evaluation."
29,"""Accuracy"" refers to the ability of an automatic classification system to correctly categorize text into different categories. The system uses the XOR method, which compares the results of the system with those of a human assessor (expert) to determine its accuracy. The numbers in the table show the number of correct and incorrect categorizations for each category. The system's accuracy is determined by comparing its results with those of the human assessor."
30,"The concept of ""accuracy"" in automatic text categorization is measured by how well the system classifies documents compared to a human expert reference. This reference is often referred to as the ""gold standard"" and may not be perfect, but is considered good enough with typically 80% agreement and a reliable methodology. In cases where a gold standard is not available, using human experts with good methodology is still better than having no reference at all. It is important to note that there is usually no ""absolute truth"" in text categorization."
31,"This section discusses the accuracy of an automatic classification system compared to a human expert. The system correctly classified 7 out of 9 documents, resulting in a 78% accuracy rate. The categories involved were A, B, and N, and the system's performance was measured using the XOR method."
32,"The document discusses a weather prediction system that can forecast weather one week in advance. The key questions raised are about the accuracy of the system and whether there is a margin of error. Additionally, the outcome of using the system, such as getting wet or angry, is also questioned. The example provided shows the system accurately predicting weather for Monday, Wednesday, and Friday, but not for Tuesday, Thursday, Saturday, and Sunday."
33,"% 10% 5% 0% 0% 10% 45% 5% 0% 2%

The confusion matrix shows the predicted and actual categories for a set of data. In this example, there are N categories and the matrix shows the percentage of data that was correctly categorized (on the diagonal) and incorrectly categorized (off the diagonal). For instance, 33% of the data was predicted to be in category A and was actually in category A, while 10% of the data was predicted to be in category A but was actually in category B. The matrix can be used to evaluate the accuracy of a categorization model."
34,"The example shows the predicted categories for a text categorization system, with categories labeled A through N. The system has correctly predicted the categories for all the documents, with a total of [REDACTED_PHONE] documents in each category. This demonstrates the effectiveness of the automatic classification system."
35,"Page 35 discusses an example of an automatic classification system using percentages to show the predicted and actual categories for a set of data. The table shows the percentage of documents that were classified into each category, with the highest percentage being the predicted category and the actual category being the one that the document belonged to. The example demonstrates the accuracy of the system in correctly classifying documents into their respective categories."
36,"The document discusses a simple 2x2 matrix used in text categorization, where 2000 documents were classified. The matrix shows the predicted and actual results, with a focus on the desired positive and negative predictions. The key points are the percentages of correct and incorrect predictions, as well as the presence of false negatives and false positives."
37,"Evaluating multiple classifiers is important in text categorization in order to determine the most effective one for a given task. This can be done through various metrics such as accuracy, precision, recall, and F-measure. It is also important to consider the type of data being used and the specific goals of the categorization task. Ensemble methods, which combine multiple classifiers, have been shown to improve performance. Cross-validation techniques can also be used to evaluate the generalization ability of classifiers. It is recommended to use multiple evaluation metrics and techniques to get a comprehensive understanding of the performance of different classifiers."
38,"The discussion focuses on the accuracy and effectiveness of two individuals, ZZ and MK, in predicting the weather. ZZ has a higher accuracy rate, correctly predicting 5 out of 7 times, while MK has a 0% accuracy rate. This makes ZZ a more reliable source for future weather predictions if one wants to avoid getting wet. In terms of classification, ZZ is considered the better classifier as they have a higher success rate in predicting the actual weather conditions."
39,"This section discusses the use of two classifiers in an automatic classification system. The system is designed to categorize documents into different categories (A, B, N) based on their content. The results from the two classifiers are compared to the actual categories determined by a human assessor. The first classifier correctly predicted 39 out of 65 documents, while the second classifier correctly predicted 5 out of 9 documents. This shows the importance of using multiple classifiers to improve the accuracy of the automatic classification system."
40,"The document discusses the comparison of two classifiers using a 2x2 matrix. The first classifier correctly predicted 900 documents as ""Y"" and 410 documents as ""N,"" while the second classifier predicted 700 documents as ""Y"" and 448 documents as ""N."" Both classifiers performed well, but the first one had a higher number of false negatives while the second had a lower number of false positives. It is unclear which classifier is better as it depends on the specific needs and priorities of the user."
41,"This section discusses the importance of considering semantics, or the meaning and context of words, in text categorization. It uses an example of a courtroom scenario to illustrate how different classifiers can have varying levels of accuracy in predicting guilty and innocent outcomes. The results show that the classifier with a higher number of correct predictions is not necessarily the better one, as it may also have a higher number of incorrect predictions. The example highlights the need for a balanced approach in text categorization and the importance of considering all aspects, such as testimony of witnesses, in making accurate predictions."
42,"The document discusses the importance of incorporating a cost function in fraud investigation in order to determine which classifier is better. It presents a scenario where two classifiers have made predictions on insurance claim statements, and shows that while Classifier #1 has a higher accuracy, Classifier #2 has a lower cost of investigation due to its lower number of false positives. The document emphasizes that the average cost of fraud for the company is $2000 and it costs $500 to investigate each suspected fraud. Therefore, in this scenario, Classifier #2 is considered to be the better option due to its lower overall cost for the company."
43,"The document discusses the importance of implementing a cost function in fraud investigation. It compares the potential losses from fraud if no action is taken (450 cases costing $900k) versus using a classifier to identify potential fraud cases. The first classifier identifies 510 cases, costing $335k, while the second identifies 748 cases, costing $378k. The document also highlights the average cost of fraud for the company ($2000) and the cost of investigating each suspected fraud ($500). Overall, implementing a cost function can help minimize losses and prioritize the most cost-effective approach to identifying and investigating fraud cases."
44,"Classifier evaluation is an important aspect of text categorization and is typically done through empirical experiments. The main focus is on the effectiveness of the classifier, or its ability to accurately classify documents. Two key metrics used in evaluation are precision and recall. Precision measures the probability that a document will be correctly classified under a specific category, while recall measures the probability that a document that should be classified under a category will be correctly identified as such."
45,"The document discusses the process of running a classifier for text categorization. It explains how to prepare the data for classification, including selecting the features and creating a training set. The classifier is then trained using a machine learning algorithm, and the accuracy of the model is evaluated using a test set. The document also covers the use of cross-validation to improve the performance of the classifier. It concludes by discussing the importance of fine-tuning the classifier and adjusting the parameters to achieve better results. Overall, the document provides a comprehensive guide for running a classifier for text categorization."
46,"The document discusses the potential for false results in text categorization, specifically in the context of spam filtering for email data. The training set used to train the categorization system may not accurately reflect the real email stream, leading to false negatives (spam emails categorized as non-spam) and false positives (non-spam emails categorized as spam). This highlights the importance of regularly updating and refining the training set to improve the accuracy of the categorization system."
47,"The issue of overfitting in training sets is discussed, with a table showing the number of correct and incorrect predictions for two classifiers. The table highlights the importance of avoiding overfitting in order to accurately predict outcomes."
48,"The concept of overfitting in machine learning is demonstrated through three training sets and two real data sets. The training sets show a high accuracy in predicting the actual outcomes, but the real data sets do not match as closely. This is due to the training sets being too specific and not generalizable to real world data. Overfitting can lead to poor performance in real world scenarios."
49,"The concept of overfitting the training set is discussed, which refers to a situation where a model performs well on the training data but poorly on new data. This can happen when the model is too complex or when there is not enough data to properly train it. Two types of errors, false negatives and false positives, can occur when overfitting the training set. These errors can lead to inaccurate predictions and affect the overall performance of the model."
50,"The document discusses the difference between hard and soft categorization in text classification. Hard categorization involves fully automated classifiers that make binary decisions, assigning a document to only one category. On the other hand, soft categorization involves semi-automated classifiers that use real-value decisions and rank categories based on their appropriateness for the document. This allows for multiple categories to be assigned to a document, which can be helpful in computer-assisted human decision making or critical applications like medical diagnosis. The example on the right shows a document, E, being assigned to three possible categories based on their probabilities."
51,"The process of aggregating multiple classifiers involves combining the predictions of several individual classifiers to make a final prediction. This can improve the overall accuracy and performance of the classification task. Different aggregation methods, such as majority voting and weighted voting, can be used depending on the type of classifiers being combined. Ensemble methods, such as bagging and boosting, are also commonly used for aggregation. Careful selection of the individual classifiers and tuning of the aggregation method are important for achieving optimal results."
