Page Number,Summary
1,"Discussion Template

The CNI Day1 Workshop Discussion Template is a tool designed to help teams organize and facilitate discussions during the workshop. It includes sections for setting the agenda, defining the objectives and goals of the discussion, and identifying key stakeholders and participants. The template also provides space for recording key takeaways and action items, as well as a section for evaluating the success of the discussion. By using this template, teams can ensure that their discussions are structured, productive, and focused on achieving their desired outcomes."
2,"The presentation discusses the idea of using LLM (Lifelong Learning Machines) as assistants in various fields. LLMs are intelligent systems that can continuously learn and adapt to new information, making them ideal for tasks such as data analysis and decision-making. The potential benefits of using LLMs as assistants include increased efficiency, accuracy, and scalability. However, there are also concerns about the ethical implications and potential biases of using LLMs. The team suggests implementing guidelines and regulations to address these concerns and ensure responsible use of LLMs as assistants."
3,"held a discussion on the first day of the CNI conference. The discussion focused on the team's goals and objectives, as well as the roles and responsibilities of each team member. They also discussed potential challenges and how to overcome them, such as communication barriers and time constraints. The team agreed on a communication plan and established a timeline for completing tasks. They also identified the need for flexibility and adaptability in their approach. Overall, the team was committed to working together and achieving their goals for the conference.

Team No. ??? held a discussion on their goals, roles, and challenges on the first day of the CNI conference. They established a communication plan, timeline, and emphasized the need for flexibility in their approach. The team is committed to working"
4,":

The first team member discussed the importance of clear communication within the team, including setting expectations, actively listening, and providing constructive feedback. They also emphasized the need for effective time management and establishing a common goal for the team to work towards. Additionally, they highlighted the importance of recognizing and utilizing each team member's strengths and delegating tasks accordingly."
5,"The document discusses the importance of effective communication and teamwork in achieving successful outcomes. It emphasizes the need for clear roles and responsibilities within a team, as well as open and respectful communication. Additionally, it highlights the benefits of diversity and inclusion in a team, as it brings different perspectives and skills to the table. The document also suggests the use of team-building activities and regular check-ins to foster a positive and cohesive team dynamic."
6,"The key points discussed during Day 1 of the CNI meeting included the importance of team dynamics and communication, as well as the role of leadership in fostering a positive team environment. The team also discussed the need for clearly defined roles and responsibilities, effective decision-making processes, and regular check-ins to ensure progress and address any issues. It was emphasized that open and honest communication, along with a shared vision and goals, are crucial for a successful team. Additionally, the team discussed the importance of diversity and inclusion within the team, as well as the need for flexibility and adaptability in a constantly changing environment. Overall, the team identified key strategies and best practices for building and maintaining a strong and cohesive team."
7,"of the document 'TeamNo_CNI_Day1-Discussion_ template.pptx' discusses the importance of having a clear understanding of the project scope and objectives. It emphasizes the need for a detailed project plan that outlines the specific goals, tasks, and timelines for the project. The document also stresses the importance of communication and collaboration among team members to ensure everyone is on the same page and working towards the same goals. It also mentions the importance of regularly reviewing and adjusting the project plan as needed to stay on track and achieve the desired outcomes. Overall, the key points on this page highlight the crucial role of a well-defined project plan and effective teamwork in achieving project success."
8,[No content to summarize]
9,": The objective of the discussion is to identify the challenges faced by the team and come up with solutions to overcome them. The team should also establish clear communication channels and roles within the team.

The objective of the discussion is to address the challenges faced by the team and establish effective communication channels and roles. This will help the team to overcome any obstacles and work efficiently towards achieving their goals. Clear communication and defined roles will promote teamwork and prevent misunderstandings within the team. The team should actively participate in the discussion and come up with practical solutions to improve their performance."
10,"The prompts should be clear, concise, and specific, using simple and direct language. They should also be structured in a logical order and anticipate potential user questions to provide a smooth and efficient experience. Additionally, the prompts should be adaptable to different scenarios and allow for user customization. The goal is to create a user-friendly and efficient virtual assistant that can assist with various tasks and objectives.

The workshop focuses on creating effective prompts for an LLM virtual assistant. These prompts should be clear, concise, and specific, with a logical structure and the ability to anticipate user questions. They should also be adaptable and allow for user customization. The ultimate goal is to create a user-friendly and efficient virtual assistant that can assist with various tasks and objectives."
11,"The document discusses the use of the LLM (Language Model) in the team's project. The LLM used is a pre-trained model called GPT-3 (Generative Pre-trained Transformer 3), which is known for its ability to generate human-like text. The team plans to fine-tune this model for their specific task and domain, as well as explore other LLMs that may be more suitable for their project. They also mention the importance of understanding the limitations and potential biases of the LLM they are using."
12,"The objective of a virtual assistant is to assist users with tasks and provide information in a conversational manner through a digital platform. This can include tasks such as scheduling appointments, answering questions, and completing simple tasks. The virtual assistant should be user-friendly and efficient in order to provide a positive user experience."
13,"The presentation discusses various scenarios where an LLM-based assistant could be useful, including daily tasks such as organizing schedules and managing emails, personal projects such as planning trips and organizing finances, and professional needs such as conducting research and preparing presentations. The LLM-based assistant can also assist with language translation, data analysis, and providing reminders and recommendations. Additionally, the assistant can be helpful for individuals with disabilities or those who are unable to perform certain tasks independently."
14,The document suggests choosing a specific scenario and defining the goal for an assistant. This goal should be clearly defined and focused on what the assistant is meant to achieve. It is important to be specific and have a clear understanding of the desired outcome when setting a goal for an assistant.
15,"of the document 'TeamNo_CNI_Day1-Discussion_ template.pptx' discusses the importance of understanding the target audience when creating a marketing strategy. It emphasizes the need to identify the target audience's needs, preferences, and behaviors in order to effectively tailor the marketing message and approach. It also suggests conducting market research and utilizing data to gain insights into the target audience. The page stresses the significance of continuously monitoring and adapting the marketing strategy based on the target audience's feedback and changing trends. Additionally, it highlights the importance of considering cultural and social factors when targeting a diverse audience. The ultimate goal is to create a personalized and relevant marketing strategy that resonates with the target audience and drives successful results."
16,[No content to summarize]
17,"The design of the assistant should be user-friendly and intuitive, with a simple and clean interface. It should have a clear purpose and specific functions, tailored to the needs of the target audience. The assistant should also have the ability to learn and adapt to user preferences over time. It should be able to provide helpful and relevant responses, with the option for users to provide feedback and improve its performance. The design should also consider accessibility and inclusivity for users with disabilities."
18,"The users of our assistant are busy professionals who need help managing their schedules and tasks. The major use cases include scheduling meetings, setting reminders, and organizing to-do lists. Our persona is a working mother named Sarah who juggles multiple responsibilities and needs assistance with staying organized. We want our assistant to schedule meetings for Sarah, with the object of focus being meeting details such as date, time, location, and participants. Parameters for the assistant would include Sarah's preferred tone and format for communication, as well as any specific sources or platforms for scheduling meetings. Additional contextual information for the assistant could include Sarah's preferences for meeting times and deadlines for tasks. Examples of specific styles or formats could include using natural language processing for scheduling meetings or integrating with popular calendar"
19,"of the document 'TeamNo_CNI_Day1-Discussion_ template.pptx' discusses the importance of having a common understanding and shared vision within a team. It emphasizes the need for open communication, active listening, and mutual respect in order to build trust and foster collaboration. The slide also highlights the role of a team leader in facilitating this process and creating a positive team culture. It stresses the importance of setting clear goals and expectations, as well as providing opportunities for feedback and reflection to ensure continuous improvement within the team. Overall, the slide emphasizes the importance of a strong team dynamic in achieving success and reaching goals."
20,[No content to summarize]
21,"for team discussion


The prompts for team discussion should be focused on the key objectives and goals of the team, as well as any challenges or issues that need to be addressed. They should encourage open communication and collaboration among team members, and allow for different perspectives and ideas to be shared. The prompts should also be clear and concise, and should guide the discussion towards finding solutions and making decisions. It is important to consider the time and resources available for the discussion, and to prioritize the most important topics."
22,"of the document 'TeamNo_CNI_Day1-Discussion_ template.pptx' discusses the importance of setting clear expectations and goals for a team. This includes defining the team's purpose, roles and responsibilities, and desired outcomes. It is important for all team members to have a shared understanding of these expectations in order to work effectively together. Clear expectations also help to hold team members accountable and track progress towards goals. Additionally, the document emphasizes the importance of regularly revisiting and adjusting expectations as needed to ensure the team stays on track and meets their objectives."
23,[No content to summarize]
24,"is a process of continuously testing and improving a product or service based on feedback and data. It involves conducting experiments, gathering data, and analyzing results to make informed decisions about changes and improvements. This process allows for a more efficient and effective development process, as it allows for early detection of issues and ensures that the final product meets the needs and expectations of the target audience. It also promotes a culture of continuous learning and adaptation, leading to a better overall product and increased customer satisfaction."
25,"The document discusses the use of a conditioned LLM (language model) in a chat setting to perform a specific task. The chat interface allows for a more natural and conversational interaction with the LLM, which has been trained on a specific task. The user can input prompts or questions, and the LLM will generate responses based on its training. The chat setting also allows for the LLM to be conditioned on different contexts or scenarios, giving it the ability to adapt and provide more accurate responses. This method of interacting with a conditioned LLM allows for a more user-friendly and efficient way of completing tasks."
26,"The discussion focused on the bot's ability to handle inputs correctly. The team discussed potential issues such as user errors, missing data, and incorrect formatting. They also discussed the importance of testing and troubleshooting to ensure the bot's accuracy and effectiveness. The team agreed to conduct thorough testing and implement error handling mechanisms to address potential issues."
27,"The document discusses the importance of using the appropriate language style for a specific persona. It emphasizes that the language style should be tailored to the persona's characteristics and preferences. This includes considering factors such as age, education level, and cultural background. Using the proper language style can help build a stronger connection with the persona and make the content more relatable and effective. It is also important to avoid using jargon or technical terms that the persona may not understand. Overall, the language style should be appropriate and relevant to the persona in order to effectively communicate with them."
28,"The conversation flow during team discussions is expected to be dynamic and may vary depending on the topic and group dynamics. It is normal for there to be pauses, interruptions, and changes in direction during the conversation. These can be opportunities for clarification, reflection, and deeper exploration of ideas. As long as everyone is respectful and actively listening, the conversation flow can be considered normal and productive."
29,"The presentation discusses the importance of handling errors effectively in a team setting. It emphasizes the need for clear communication and collaboration among team members to identify and address errors. It also suggests implementing a system for tracking and resolving errors, as well as conducting regular reviews to prevent future errors. Overall, the presentation emphasizes the importance of a proactive and organized approach to handling errors within a team."
30,"by the team in implementing the project were discussed during the first day of the CNI program. These included limited resources, lack of support from higher management, and resistance to change. The team also faced difficulties in aligning their project with the organization's goals and objectives. They identified the need for clear communication and collaboration among team members, as well as the importance of addressing any conflicts that arise. Strategies such as seeking external support and breaking down tasks into smaller, manageable chunks were suggested to overcome these challenges. Overall, the team recognized the need for flexibility and adaptability in order to successfully navigate these restrictions and challenges. 

During the first day of the CNI program, the team discussed the restrictions and challenges they faced in implementing their project. These included"
31,"The document discusses the observations and lessons learned from the first day of the CNI (Collaborative Networked Organizations) training. Some key points include the importance of clear communication and collaboration within a team, the need for flexibility and adaptability in a constantly changing environment, and the value of actively listening and seeking diverse perspectives. Other observations and lessons learned include the significance of setting clear goals and objectives, the benefits of utilizing technology and digital tools for efficient communication, and the importance of fostering trust and respect within a team. Overall, the document highlights the importance of effective teamwork and communication in successfully navigating the challenges of a collaborative networked organization."
32,"of the document 'TeamNo_CNI_Day1-Discussion_ template.pptx' discusses the importance of establishing a shared understanding within a team. This includes having a clear purpose and goals, as well as understanding each team member's strengths and weaknesses. It also emphasizes the importance of effective communication and building trust among team members. The document suggests using team-building activities and regular check-ins to foster a strong team dynamic. Additionally, it highlights the need for flexibility and adaptability in a team, as well as the importance of addressing conflicts and resolving them in a timely manner. Overall, the key points on this page emphasize the importance of establishing a strong foundation for teamwork in order to achieve success."
33,[No content to summarize]
34,"should include:


The final prompts for the team discussion should include questions that encourage reflection and discussion on the team's goals, progress, and challenges. These prompts should also address the team's communication and problem-solving strategies, as well as individual contributions and roles within the team. Additionally, the prompts should prompt the team to consider potential barriers and solutions for achieving their goals."
35,"of the document 'TeamNo_CNI_Day1-Discussion_ template.pptx' discusses the importance of effective communication within a team. It highlights the fact that clear communication is essential for successful teamwork and achieving common goals. The slide also emphasizes the need for active listening, open and honest communication, and the use of appropriate communication channels. It also mentions the impact of cultural differences on communication and the importance of being respectful and understanding of different perspectives. The slide concludes by emphasizing the role of effective communication in building trust and fostering a positive team dynamic."
