Page Number,Summary
1,"This document discusses spatial reasoning and its application in vision-based localization. It outlines the key concepts and principles of spatial reasoning and how it can be used to improve localization techniques. The author, Dr. Tian Jing, explains the importance of spatial reasoning in various real-world scenarios and provides insights on how it can be incorporated into existing localization systems. The document is copyrighted by the National University of Singapore and all rights are reserved."
2,"The document discusses the topic of spatial reasoning, specifically in the context of self-supervised learning from autonomous driving data. It highlights the importance of vision-based localization and visual odometry in this field, as well as the role of place recognition. The document also references a tutorial on self-supervision in this area, which will be presented at ECCV 2022."
3,"The document discusses the use of spatial reasoning in computer vision, specifically in the areas of visual odometry and visual place recognition. These techniques involve the use of feature extraction, encoding, and indexing to accurately track and recognize locations and objects in images. The document outlines the agenda for discussing these topics in further detail."
4,"The document discusses the use of spatial reasoning in localization, which is important for navigation and display purposes. This can be achieved through various methods such as GPS, wheel odometry, and vision data. While GPS and wheel odometry may have limitations in certain environments, vision-based solutions are more accurate and can achieve a translational error of 0.5%-1% of the travelled distance according to the KITTI dataset leaderboard."
5,"The document discusses the concept of visual odometry, which is the process of using camera images to determine the movement and position of a robot. This is achieved by analyzing consecutive frames and identifying the same point in the physical world, which appears in different positions due to the camera movement. This technique can be used in a use case scenario where a mobile robot with cameras moves around a campus, and the objective is to infer the camera movement parameters to also determine the robot's movement. This technique is useful for determining the camera movement trajectory and can be applied in various applications."
6,"Visual odometry is a method used for estimating the position and orientation of a camera in a given environment by analyzing consecutive images. This technique assumes that the scene has distinct content, sufficient texture and illumination, and enough overlap between frames. It also requires the dominance of static scenery over moving objects. This technology has various applications, such as in navigation and mapping."
7,"The KITTI dataset is a collection of data used for testing and evaluating spatial reasoning algorithms. It includes recordings from two stereo cameras and a LiDAR sensor, with 6 hours of footage captured at 10 frames per second. The dataset also includes ground truth camera poses for performance evaluation, with the X, Y, and Z directions defined as right, up, and forward, respectively."
8,"The document explains the key concepts related to spatial reasoning, specifically the coordinate systems used in spatial reasoning. These include the origin, dimension, and unit of each coordinate system, as well as the camera reference system, image reference system, and pixel reference system. The document also discusses the relationship between these coordinate systems and how they are affected by camera movement. This is represented by the extrinsic matrix for the relationship between two coordinates of the same point, the pinhole camera model for the relationship between the camera reference system and image reference system, and the intrinsic matrix for the relationship between the image reference system and pixel reference system. The document also mentions the camera center and its movement as important factors in understanding spatial reasoning."
9,"The document discusses the extrinsic matrix, which is used in spatial reasoning to represent the translation and rotation of objects in 3D space. It includes specific matrices for translation only, rotation only around the z-axis, and translation + rotation. The document also mentions homogeneous coordinates and how they are used to represent points in 3D space with respect to different camera centers. The formula for converting between coordinates with respect to two different camera centers is also provided."
10,"The pinhole camera model is used to convert coordinates from the camera reference system to the image reference system, and depends on the focal length of the camera. The triangle similarity theorem is used in this conversion, with the focal length and camera coordinates being key factors. The formula can be rearranged into a matrix format for easier use. This information can be found in Module 2 of the Vision Algorithms for Mobile Robotics course."
11,"The intrinsic matrix is a mathematical representation of the camera's internal parameters, including focal length, skew, and principal point. It is used to convert between the image reference system and the pixel reference system. The intrinsic matrix can be calculated using the camera's physical size and image plane origin. It is typically represented as a 3x3 matrix, with the focal length and principal point values in the center. This matrix is important for camera calibration and spatial reasoning tasks."
12,Visual odometry is a process used to estimate camera motion by finding matched points between two consecutive frames and using the pinhole camera model and intrinsic matrix to obtain their coordinates in physical world. The extrinsic matrix is then estimated to determine the camera's movement trajectory. This technique is commonly used in spatial reasoning and can be applied in various scenarios such as in cars or carried by humans.
13,"The agenda for this section covers visual odometry, visual place recognition pipeline, feature extraction, feature encoding, and feature indexing. Visual odometry involves estimating the motion of a camera using visual inputs. The visual place recognition pipeline is a process for recognizing previously visited locations using visual features. Feature extraction involves identifying key points in an image, while feature encoding converts these points into a numerical representation. Feature indexing is the process of organizing and storing these features for efficient retrieval."
14,"The document discusses the use of visual place recognition in solving the global localization and loop closing problems in spatial reasoning. This involves using a pre-collected gallery of images with location annotations, rather than relying on the starting frame as the reference point. Place recognition can also help with loop closure detection to avoid duplication, and loop correction to compensate for camera pose error drift. The proposed method matches input photos to the gallery to determine the location of the input photo."
15,"The concept of visual place recognition is motivated by the need for image-based location and place identification. This involves techniques such as image retrieval, which allows for the recognition of previously seen images and finding similar images in a database. A practical example of this is Google's Reverse Image Search feature."
16,"Visual place recognition is an important aspect of spatial reasoning for robots. It involves using images to determine if a robot has been to a particular location before and which images were taken in that area. This is necessary for tasks such as localizing the robot and building a map of the environment. Pure localization with a known map and SLAM (simultaneous localization and mapping) are two methods used for this purpose. In order to accurately build a map, the robot's camera pose must be estimated. Mapping with known robot poses is another approach, but SLAM is preferred as it does not require prior knowledge of the robot's workspace. This concept is essential for path planning and robotics."
17,"The process of visual place recognition involves computing a descriptor for each image and comparing it to the descriptors in a reference image database. This results in a pairwise descriptor similarity matrix, which is used to make matching decisions between the reference images and the query images. This process is explained in more detail in the article ""Visual Place Recognition: A Tutorial"" from the IEEE Robotics & Automation Magazine."
18,"Visual place recognition is a challenging task that involves identifying a specific location based on visual cues. This can be affected by lighting changes, changes in camera viewpoint, and occlusions from objects such as people, cars, and trees. A survey on visual-based localization highlights the importance of using heterogeneous data in this process."
19,"Visual place recognition has made significant progress in the past two decades, with milestones including the introduction of the BoW model in 2003 and the shift towards CNN-based methods. The SIFT-based methods are still being used, but CNN-based methods are becoming more dominant. Some notable references in this field include the SIFT Meets CNN survey and papers such as Video Google, Aggregating local descriptors, Neural codes for image retrieval, and Particular object retrieval with integral max-pooling."
20,"The document discusses three major datasets for visual place recognition: Oxford5k, Paris6k, and Holidays. These datasets contain a large number of images and queries related to buildings and scenes. The document also references two papers related to object retrieval and large-scale image search using spatial matching and Hamming embedding."
21,"The document discusses the performance evaluation of a spatial reasoning system using single and multiple queries. The performance metric is measured by comparing the returned results from the gallery to the query image, with a ranking system used to determine the accuracy. The document addresses the methods for evaluating system performance in both single and multiple query scenarios."
22,"The document discusses the performance metric for spatial reasoning, specifically the use of precision and recall to evaluate the accuracy of a ranked list of returned results. The key points include the definition of precision and recall, the calculation of average precision and mean average precision, and the importance of considering the dataset when determining the expected number of true positives. The document also provides an example of a ranked list of results with corresponding true/false labels."
23,"The visual place recognition pipeline involves three main steps: feature encoding, feature extraction, and feature indexing. The feature encoding uses a dictionary to represent visual features. Feature extraction involves extracting features from images. Feature indexing involves searching for similar features in a database. This process is based on a method called SIFT Meets CNN, which combines traditional methods with deep learning techniques."
24,"The document discusses different types of feature extraction methods for spatial reasoning, including hand-crafted global image features, local patch features, and point-based patch features. These features are used for place recognition, with global features being more effective for coarse recognition and local features being better for fine recognition. The document also mentions pre-trained and tuned/re-trained CNNs as potential feature extraction methods."
25,"ORB (Oriented FAST and rotated BRIEF) is a feature detection algorithm used in image processing to determine interest points or keypoints. It works by comparing the intensity of a pixel with its neighboring pixels and using a threshold to determine if it is a keypoint. A faster version of the algorithm compares the intensity of only four pixels in a circle and requires at least three of them to satisfy the threshold criterion. If not, the pixel is rejected as a possible keypoint. Rotation calibration is used to determine the orientation of the keypoint."
26,ORB (Oriented FAST and rotated BRIEF) is a feature descriptor used in spatial reasoning that samples intensity pairs within a patch centered at a keypoint and creates a binary code descriptor of 128 bits. This descriptor is suitable for fast matching using the Hamming distance method. The pattern used to generate the descriptor is randomized but can also be replaced with a fixed structure pattern.
27,"The LIFT (Learned Invariant Feature Transform) model is used for spatial reasoning and has a Siamese training architecture with four branches. Patches P1 and P2 are used as positive examples to train the descriptor, while P3 is used as a negative example. P4 is used as a negative example to train the detector. The model includes a detector loss, orientation loss, and descriptor loss. LIFT is a learning-based descriptor and uses networks to detect keypoints, predict patch orientation, and generate a patch descriptor. The model was introduced in the ECCV 2016 conference and can be found in the reference provided."
28,"is a method for automatically detecting and describing keypoints in images without the need for manual annotation. The method uses a combination of interest point detection and descriptor losses, and uses pairs of synthetically warped images to train the model. This approach reduces the need for manual annotation and has been shown to be effective in detecting and describing keypoints in images."
29,"The document discusses the use of pre-trained CNN networks as high-level descriptors for spatial reasoning tasks. It explains that the feature activation from the top layers of the CNN can be used as a global descriptor, with dimensions of 6x6x256 or 9216. Alternatively, fully connected layers can also be used as global descriptors with dimensions of 4096. The document references a study that used these methods for image retrieval. It also includes a simplified version of the AlexNet architecture, which includes input layers, convolutional layers, pooling layers, normalization layers, and fully connected layers."
30,"pooling

This section discusses the use of maximum activations of convolutions (MAC) in pre-trained convolutional neural networks (CNNs). MAC involves spatial max-pooling over all locations in a set of 2D convolutional feature channel responses to create a global feature vector. This technique has been shown to be effective in particular object retrieval and is referenced to a relevant study. The formula for MAC is also provided."
31,This page discusses the use of pre-trained convolutional neural networks (CNN) for maximum activations in spatial reasoning. The process involves sampling regions at different scales and using a fixed multi-scale overlapping spatial region pooling technique. The reference for this method is provided and a diagram is shown with a cross indicating the region centre and dashed borders representing neighbouring regions towards each direction.
32,"The document discusses the use of pre-trained CNN models in spatial reasoning and instance retrieval. These models use activation maps to identify and classify objects in images. Many other methods also utilize these pre-trained CNN models. A survey on deep learning for instance retrieval is available at a specific link, but the phone number has been redacted."
33,"The article discusses the use of contrastive loss, triplet loss, and quadruplet loss in re-trained CNNs for spatial reasoning. These methods aim to decrease the distance between positive pairs (input data from the same place) and increase the distance between negative pairs, in order to improve place recognition accuracy. The quadruplet loss, in particular, adds an additional constraint that reduces intra-class variations and increases inter-class variations. These techniques have been shown to be effective in improving the performance of CNNs for spatial reasoning tasks."
34,"The visual place recognition pipeline involves three main steps: feature extraction, feature encoding (using a dictionary), and feature indexing for search. This process is based on the combination of SIFT and CNN techniques, as described in a 2018 survey by Zheng et al. The specific details of this process have been redacted."
35,"The concept of intuition in spatial reasoning involves understanding and representing objects as a collection of individual parts and their relative locations. This approach is based on the idea of a ""part model,"" where the appearance and arrangement of each part is important for understanding the whole object. This concept is supported by the research of Fischler and Elschlager, who studied the representation and matching of pictorial structures in computer science."
36,"The concept of intuition in spatial reasoning is demonstrated through the use of a histogram, which is a visual representation of data using bars to show the frequency of values in a set. In this case, the histogram is computed over integers from 0 to 4, using samples that are encoded and pooled into one vector. The codebook or vocabulary used in this example is related to color space."
37,"The document discusses the use of Spatial Reasoning Skill Development (SRSD) in education, specifically focusing on the concept of intuition and document representation. Intuition refers to the ability to understand and make decisions based on one's own instincts and experiences. In the context of SRSD, intuition is used to identify keywords in a document and represent them based on their frequency in a dictionary. This approach can help students develop their spatial reasoning skills by analyzing and interpreting visual information."
38,"involve extracting feature descriptors from images, clustering them to create a visual vocabulary, and then assigning each feature descriptor to a visual word. This process is used to generate a histogram for each image, which combines the frequencies of the visual words. This approach is commonly used in image recognition and classification tasks."
39,"VLAD (Vector of Locally Aggregated Descriptors) is a method for compactly representing local image descriptors. It involves assigning descriptors to cluster centers, computing residuals, and aggregating them for each cluster. This is done by using a hard or soft assignment method and summing the residuals for each cluster. The resulting vectors can be concatenated to form a compact representation of the original descriptors. This method is based on a reference paper from 2011 and uses a hyperparameter called alpha."
40,The document discusses the use of a NetVLAD layer in a CNN framework for extracting image-level descriptors. This layer uses trainable parameters such as vector 𝒘𝒘𝑘𝑘 and scalar 𝒃𝒃𝑘𝑘 to calculate residuals for each cluster center 𝒄𝒄𝑘𝑘. The model is trained using contrastive learning with labelled images from the Internet. The NetVLAD layer is integrated into the existing CNN architecture and uses a 1x1 convolution and softmax function for aggregation. Residuals are calculated for each cluster and the input image is processed through the CNN.
41,Patch-NetVLAD is a method for image retrieval that uses NetVLAD descriptor comparisons to rank the most likely reference matches for a query image. It then computes new patch-level descriptors at multiple scales to perform local cross-matching and uses geometric verification to refine the initial list of matches. This results in improved image retrievals. Patch-NetVLAD was presented at CVPR 2021 and its details can be found in the referenced paper.
42,"The document discusses the Contextual patch-NetVLAD, a feature descriptor and matching mechanism for visual place recognition. It aggregates features from a patch's surrounding neighborhood and uses cluster and saliency context-driven weighting rules to assign higher weights to patches that are less similar to densely populated or locally similar regions. This allows for more accurate and robust place recognition. The reference for this approach is provided as well."
43,"The BoW similarity evaluation method compares two images based on their BoW representations, which are arrays of numbers. The Histogram Intersection technique calculates the minimum value for each bin in the histograms of the two images, and then calculates the sum of these minimum values. The Euclidean distance method calculates the distance between the histograms of the two images. The reference provided explains this concept further."
44,"The visual place recognition pipeline involves three main steps: feature extraction, feature encoding, and feature indexing. Feature extraction involves identifying and extracting key features from an image. Feature encoding refers to creating a dictionary of these features to represent the image. Feature indexing involves using this dictionary to search for similar features in a database. This process is based on a method called SIFT Meets CNN, which has been used in instance retrieval for over a decade."
45,"The concept of vocabulary trees is a method for organizing large vocabularies in a hierarchical clustering structure. This approach was first introduced by Nister and Stewenius in 2006, and it has been shown to be effective for scalable recognition tasks. The construction of a vocabulary tree involves recursively partitioning the vocabulary based on similarity measures between visual words. This allows for efficient and accurate matching of visual features in large datasets."
46,"The vocabulary tree is an inverted file index that organizes words and images in a hierarchical structure. It allows for efficient searching and retrieval of images based on their features and keywords. The tree is constructed using a feature dictionary and a set of gallery images, and it can be used to rank query results. This method is useful for spatial reasoning and can be applied in various fields such as image recognition and retrieval."
47,"with features

The Vocabulary Tree is a method for indexing and recognizing objects in images. It involves creating a tree structure with nodes representing different visual features, such as color or texture. These features are then used to fill the tree, allowing for efficient and scalable recognition of objects in images. This method was proposed by Nister and Stewenius in 2006 and has been shown to be effective in various applications."
48,"with features

The vocabulary tree is a data structure used for efficient indexing and retrieval of visual features in large datasets. It is based on the concept of hierarchical clustering and is filled with features extracted from images. This allows for fast and accurate matching of features between images, making it useful for tasks such as image retrieval and object recognition. The vocabulary tree has been shown to be scalable and effective in various applications, making it a valuable tool for spatial reasoning and other computer vision tasks."
49,"The Vocabulary Tree is a method for indexing and retrieving images based on their visual features. It involves creating a tree structure where each node represents a visual word, and the leaves contain the actual images. The tree is filled by assigning images to the appropriate nodes based on their visual features. This allows for efficient retrieval of similar images by traversing the tree and comparing visual features at each node. This method has been shown to be effective in large-scale image retrieval tasks."
50,"expansion

The vocabulary tree is a hierarchical data structure used for efficient image recognition and retrieval. It is based on the concept of visual words, where an image is represented as a collection of these visual words. The vocabulary tree allows for efficient indexing and searching of images by organizing the visual words into a tree structure. Query expansion is a technique used to improve the accuracy of image retrieval by expanding the initial query with similar visual words from the vocabulary tree. This allows for a more comprehensive search and better retrieval results. The vocabulary tree and query expansion have been successfully applied in various computer vision tasks, such as object recognition and image retrieval."
51,"The objective of this workshop is to learn how to perform image-based place recognition using the Scene recognition dataset and the Neural Codes for Image Retrieval. Global sum-pooling, a method for aggregating deep convolutional features, will also be covered. These resources can be found at the provided links."
52,"On page 52 of the document 'SRSD 2 Spatial reasoning v3.4.pdf', it is stated that the content is copyrighted by National University of Singapore and all rights are reserved. The page also includes contact information for Dr. Tian Jing, with their email being redacted."
