Page Number,Summary
56,"The National University of Singapore has created a platform called OpenAI API - PlayGround, which allows users to input prompts to generate completions. The platform also provides a way to view the meanings of each parameter and test the APIs by adjusting them. This tool can help accelerate digital excellence."
57,"This section discusses the use of the National University of Singapore's Text Completion API to generate text. It provides an example of using the API to generate an article on the ChatGPT API, and outlines the necessary steps, such as setting the openai.api_key and choosing the appropriate engine and parameters. The generated text is then stored in the variable ""message"" for further use."
58,"ChatGPT is a digital tool developed by National University of Singapore that utilizes gpt-3.5-turbo technology to support a variety of tasks, including drafting emails, writing Python code, answering questions about documents, creating conversational agents, providing natural language interfaces for software, tutoring, language translation, and character simulation for video games."
59,"The National University of Singapore has a tool called ChatGPT that uses GPT-3.5-turbo model to generate chat completions. This tool is an example of accelerating digital excellence. It takes in messages from different roles, such as system, user, and assistant, and uses the information to generate a response. In the example provided, the user asks about the winner of the 2020 World Series and the location of the game, and the assistant responds with the correct information. This tool showcases the capabilities of GPT-3.5-turbo and its potential to enhance digital interactions."
60,"This section discusses the use of openai for speech-to-text processing and speech translation. It provides examples of how to import audio files and use openai to transcribe and translate them. The code examples use the ""whisper-1"" model for both tasks."
61,"The document provides links to the social media pages of the Institute of Systems Science (ISS) at the National University of Singapore (NUS). These include Facebook, Instagram, YouTube, LinkedIn, and the ISS website. These pages can be accessed through the provided links and can provide updates and information about the institute and its activities."
