Page Number,Summary
1,"þ


Dr. Gary Leung is the instructor for the Speech Analytics II course. His email is provided for contacting him."
2,"Techniques

The fifth topic of the day focused on emerging advanced speech processing techniques. These techniques include deep learning, which uses neural networks to improve speech recognition accuracy, and end-to-end speech recognition, which eliminates the need for intermediate steps in the recognition process. Other techniques discussed were speaker diarization, which separates multiple speakers in a conversation, and speech enhancement, which improves the quality of speech in noisy environments. The speakers also highlighted the importance of data collection and the challenges of implementing these techniques in real-world applications."
3,"This section discusses the role of speech foundation models in speech recognition systems. These models are used to represent the acoustic properties of speech signals and aid in the recognition process. The most commonly used models are Hidden Markov Models (HMMs) and Deep Neural Networks (DNNs). HMMs are based on the assumption that speech signals can be divided into small segments with distinct acoustic properties, while DNNs use multiple layers of neural networks to capture complex acoustic patterns. Both models have their strengths and weaknesses, and researchers are constantly exploring ways to improve them for better speech recognition performance."
4,"The document discusses different types of learning in the context of accelerating digital excellence. Supervised learning requires human labeled data, which can be costly and time-consuming to build. Unsupervised learning does not require human labels and is easier to build databases with. Semi-supervised learning uses a small amount of labeled data, while self-supervised learning uses information from the input data to learn representations."
5,"The National University of Singapore SSL Framework for accelerating digital excellence involves two stages. The first stage utilizes self-supervised learning (SSL) to pre-train an upstream model. In the second stage, the downstream task uses the learned representation from the pre-trained model, which can be either frozen or fine-tuned using supervised data. This framework aims to improve the efficiency and effectiveness of digital learning and development."
6,"Wav2Vec 2.0 is a self-supervised learning method for training speech representation. It utilizes quantization to create targets and maximizes the similarity between the learned contextual representation and the quantized input features. This framework was developed by A. Baevski, H. Zhou, A. Mohamed, and M. Auli in 2020."
7,"The Wav2Vec 2.0 model has shown promising results in low resource languages, achieving a Word Error Rate (WER) of 8.2% with only 10 minutes of fine-tuning data. This level of performance is typically only achieved with thousands of hours of speech data. The model's architecture has been fine-tuned to optimize its performance."
8,"The document discusses the use of self-supervised learning to create speech representations, which can then be applied in various downstream applications. These representations are available on the GitHub repository s3prl."
9,"The document discusses various toolkits for accelerating digital excellence, including FAIRSEQ, S3PREL, ESPNet, and SpeechBrain. These toolkits offer pre-trained models such as wav2vec, vq-wav2vec, and data2vec, as well as libraries for pre-training and fine-tuning tasks. One example is SpeechBrain's benchmark for fine-tuning Wav2vec 2.0 and HuBERT models. These toolkits are designed to improve the performance and efficiency of speech recognition and other digital tasks."
10,"Self-supervised learning is a low-cost solution for improving accuracy in speech recognition by using unlabelled data and contextual information. Combining self-learned representation and fine-tuning has been shown to improve accuracy in low resource scenarios. This approach has also demonstrated success in other tasks such as speaker recognition, emotion recognition, and speech separation."
11,"Part 2 of the document discusses multi-talker speech recognition, which is the ability to recognize and understand speech from multiple speakers at the same time. The key points include the challenges of multi-talker speech recognition, such as overlapping speech and varying speaker characteristics, and the different approaches that have been used to address these challenges. These approaches include separating the speech signals using spatial or temporal cues, as well as using machine learning techniques to identify and distinguish speakers. The document also mentions the importance of using realistic and diverse datasets for training and evaluating multi-talker speech recognition systems."
12,"The document discusses the challenges of achieving accurate speech recognition in scenarios with multiple speakers talking at the same time. While end-to-end (E2E) systems have high accuracy in single-speaker applications, they struggle in multi-speaker scenarios. To address this issue, E2E multi-talker models have been developed as a solution. These models aim to improve accuracy by considering multiple speakers and their interactions."
13,"The paper discusses a new method called Token-level Serialized Output Training (t-SOT) for improving speaker-attributed automatic speech recognition (ASR). This method uses token-level speaker embeddings, which are small pieces of information about a speaker's voice, to improve the accuracy of ASR. The authors conducted experiments and found that t-SOT outperformed other methods in terms of speaker identification and recognition accuracy. They also found that t-SOT was able to adapt to new speakers more quickly, making it a promising technique for streaming ASR. This research was presented at the Interspeech conference in 2022."
14,"Part 3 of the document focuses on speech-to-speech translation and the challenges associated with it. The key points include the difficulty in accurately translating speech due to variations in dialects and accents, the use of statistical models and machine learning to improve translation accuracy, and the importance of considering cultural and contextual factors in translation. The document also discusses the limitations of current speech-to-speech translation technology and the need for further research and development in this area."
15,"The document discusses popular methods for simultaneous speech translation (ST), including re-translation and wait-K. Re-translation involves re-translating partial automatic speech recognition (ASR) results, but it is costly and unstable due to multiple calls to machine translation (MT). Wait-K involves starting translation after waiting for K words, but it is limited by pre-determined values and interleaving read-write operations."
16,"The article discusses the possibility of building a simultaneous direct speech translation system by treating speech translation as an automatic speech recognition (ASR) problem. This approach has been successful in streaming end-to-end ASR, making it a promising method for streaming ST. The authors propose using streaming Transformer Transducer to achieve this goal, citing a study by Xue et al. (2022) as evidence."
17,"The document discusses the concept of accelerating digital excellence and introduces the use of a flexible RNN-T path. This path is used to label frames in a sequence of data, with the goal of improving the accuracy and efficiency of digital processes. The National University of Singapore is involved in this project and can be contacted for more information."
18,"The Streaming Multilingual Speech Model (SM^2) is a small and efficient model that can perform both speech translation (ST) and automatic speech recognition (ASR) functions. It is trained using pooled multilingual data and does not require any human labeled parallel corpus for ST training. This makes it a truly zero-shot model with weakly supervised learning capabilities. The model is designed to run on devices, making it accessible and practical for various applications."
19,"Part 4 of the document discusses speech large language models, which are AI models that can generate human-like speech. These models are trained on large amounts of data and can be used for tasks such as speech recognition and text-to-speech conversion. The main challenges in developing these models include data collection, model training, and evaluation. The document also discusses potential applications of speech large language models, such as virtual assistants and voice-controlled devices."
20,"The speech LLM, or large language model, works by adding audial embeddings to the text token embeddings, allowing it to function as an automatic speech recognition system. The LLM, specifically the LLaMA-7B model, has been found to outperform monolingual baselines by 18% and can perform multilingual speech recognition despite being trained mostly on English text. This technology has the potential to greatly improve speech recognition capabilities."
21,"Yassir Fathullah and his team presented a method for integrating speech recognition abilities into large language models, in order to improve their performance. This involves training the model on both speech recognition and language tasks, and using a joint loss function to optimize both tasks simultaneously. The results show that this approach can significantly improve the performance of large language models, especially in low-resource settings. This has potential applications in various fields such as natural language processing and speech recognition."
22,Yassir Fathullah and his team presented a method for enhancing large language models (LLMs) with speech recognition abilities. They proposed a prompt-based approach that uses pre-trained LLMs and a speech recognition model to generate text responses to user prompts. This method showed improved performance compared to traditional LLMs in tasks such as question answering and dialogue generation. They also discussed the potential applications of this method in improving human-computer interaction and creating more human-like artificial intelligence.
23,".

AudioPaLM is a large language model that combines text-based and speech-based models into one multimodal architecture. It is capable of processing and generating both text and speech and has applications in speech recognition and speech-to-speech translation. The model has shown superior performance in speech translation tasks and can also perform zero-shot speech-to-text translation for languages that were not included in its training data."
24,"AudioPaLM is a project by the National University of Singapore that aims to advance digital excellence in the field of audio processing. It focuses on developing innovative algorithms and techniques for processing and analyzing audio signals, with applications in areas such as speech recognition, music information retrieval, and acoustic event detection. The project also aims to train students in this field and collaborate with industry partners to bring these advancements to real-world applications. By accelerating digital excellence, AudioPaLM hopes to contribute to the growth of the digital economy and improve the quality of life for individuals."
25,"Spoken dialogue processing is the study of how computers can understand and respond to human speech in conversation. This involves several components, including speech recognition, natural language understanding, and dialogue management. Speech recognition is the process of converting spoken words into text, while natural language understanding focuses on interpreting the meaning behind the words. Dialogue management is responsible for generating appropriate responses and keeping track of the conversation context. Challenges in spoken dialogue processing include dealing with different accents and speech patterns, as well as understanding ambiguous or informal language. Research in this field aims to improve the accuracy and efficiency of spoken dialogue systems, making them more natural and user-friendly."
26,"The FAANUS | oo = eo of Singapore is a program that aims to promote the use of open source software in the country. It is a collaboration between the Free and Open Source Software Association (FAANUS) and the Infocomm Development Authority (IDA) of Singapore. The program is divided into three parts: introduction, implementation, and sustainability. The introduction phase focuses on creating awareness and understanding of open source software among government agencies, businesses, and individuals. It also includes training and support for those interested in adopting open source software."
27,"The document discusses examples of spoken dialogue, such as speech assistants like Amazon Echo, Google Home, and Siri, as well as robots, social robots, and in-car navigation and information systems. These technologies aim to improve the user experience by providing voice-controlled interfaces for tasks such as answering questions, providing information, and controlling devices. They are part of the larger trend towards digital excellence and are constantly evolving and improving."
28,"The National University of Singapore is focused on accelerating digital excellence through the development of a Spoken Dialogue System (SDS). This system includes a speech recognizer, speech synthesizer, and dialogue system, which work together to listen to human voice, respond in speech, and understand language. This technology has the potential to greatly improve communication and interaction between humans and machines."
29,"This section discusses important factors to consider when building a Software-Defined Storage (SDS) system. The first consideration is the storage architecture, which includes choosing the type of storage media and the data placement strategy. Next, the network architecture must be carefully planned to ensure efficient data transfer between storage nodes. The third consideration is the data protection and disaster recovery strategy, which involves selecting appropriate backup and replication methods. Additionally, the scalability and performance of the SDS system must be considered, as well as the management and monitoring tools that will be used. Finally, the cost and budget for the SDS system should be carefully evaluated to ensure it aligns with the organization's needs and resources. 

Building a Software-Defined Storage system requires careful consideration of several"
30,"The purpose and scope of a digital system should be defined in terms of its domain, functionality, and target user base. The system can either be domain-specific or open-domain, with specific tasks it should perform such as information retrieval or transaction processing. The target users should also be considered in terms of their language, tone, and complexity of dialogue."
31,"The document discusses the importance of speech recognition in achieving digital excellence. Automatic Speech Recognition (ASR) is a key component that converts spoken language into text, and factors such as accuracy, real-time processing, and noise handling should be considered. Acoustic and Language Models are also crucial in accurately recognizing speech patterns and predicting word sequences. It is important for the preprocessing component to deliver a correct speech signal for optimal performance."
32,"On page 32, the document discusses the importance of speech synthesis, specifically text-to-speech (TTS) technology. It emphasizes the need to consider the naturalness and intelligibility of the synthesized voice when converting system responses into spoken language. Additionally, the document suggests carefully selecting a voice that is appropriate for the application's context and target audience."
33,"The document discusses the importance of user experience (UX) and design in creating an effective digital system. It highlights four key aspects that contribute to a good UX: prompt design, error handling, turn-taking, and feedback. Prompt design refers to how the system starts and guides the conversation with the user. Error handling involves how the system responds to inputs that it does not understand. Turn-taking is about managing interruptions and overlapping speech. Lastly, feedback is provided through auditory cues, such as a beep, to indicate that the system is listening or processing. These elements are crucial in creating a positive and efficient user experience."
34,"The document discusses the importance of evaluation and testing in accelerating digital excellence. Usability testing involves involving real users to test the system's functionality and user experience, while performance metrics measure accuracy and response time. Continuous improvement is also emphasized, with regular updates based on user feedback and error analysis."
35,The key points on scalability and deployment of digital systems include ensuring that the infrastructure can handle the expected number of users and being able to scale if needed. Integration with other systems or databases should also be considered. This is important for accelerating digital excellence.
36,"The concept of multimodality and fallback strategies are important considerations when designing a digital system. Multimodality involves integrating different modes of interaction, such as touch or visual displays, into the system. Fallback strategies are necessary for when the system is unable to understand or process a user's request. This could involve redirecting to a human operator or asking the user to rephrase their request. These considerations are crucial for ensuring digital excellence."
37,"Part 3 of the document discusses dialog flow, which refers to the structure and organization of a conversation between a user and a chatbot or virtual assistant. It explains the importance of designing a clear and logical flow to ensure a smooth and efficient interaction. The key points include understanding the user's intent, anticipating potential user responses, and using branching logic to guide the conversation. It also emphasizes the need for testing and refining the dialog flow to improve the user experience."
38,"Dialogflow is a Google Cloud product that allows users to build conversational user interfaces using natural language understanding. It supports both text and speech as input and output. Google Cloud offers a variety of products, including NLP, computer vision, machine learning, and big data."
39,"The document discusses concepts related to Dialogflow, a tool used to handle conversations with end users. These concepts include agents, which are modules that manage the conversation, intent detection, which categorizes end-user intentions, and entity recognition, which identifies and extracts specific data from end-user expressions. Examples of data that can be extracted include dates, times, colors, and email addresses."
40,"Dialogflow is a platform that supports both speech input and output, which can be configured to use either text or speech. It also offers APIs for easy integration. There are two methods for speech input: passing the full recording to the speech engine or streaming the recording in smaller segments."
41,"This section focuses on using Dialogflow, a natural language understanding platform, to create conversational interfaces for chatbots and virtual assistants. It covers the basics of setting up a Dialogflow agent, creating intents and entities, and integrating it with different platforms such as Facebook Messenger and Google Assistant. The tutorial also includes tips for improving the accuracy and user experience of the chatbot, such as adding training phrases and using context and follow-up intents. Additionally, it provides resources for further learning and troubleshooting."
42,"The task is to create a dialog demo that can assist with booking a meeting room. The necessary information for this includes the date, time, duration, location, and room name. The predefine dialogue will be loaded from a file and APIs will be used to support speech recognition and speech synthesis."
43,"The document discusses how to use Dialogflow with Speech API to create an agent. To do so, a Google account is required and the user must go to the Dialogflow Console to create an agent by providing a name, language, and timezone. The project is automatically created and the user should keep a record of the Project ID. An existing project can also be imported using the RoomReservation.zip file."
44,"The document discusses creating intent in Google's Dialogflow CX platform. It explains that if a user wants to create an intent from scratch rather than importing it, they can refer to the website provided. This process is important for accelerating digital excellence."
45,"The document discusses how to accelerate digital excellence by using Dialogflow with Speech API. It outlines the steps to create a service account key, which involves selecting a project, creating a service account, and selecting the project owner role. The document also mentions the option to manage keys and create a new key in JSON format, which can be saved for future use."
46,"The document discusses how to use Dialogflow with Speech API, which allows for the integration of speech recognition and text-to-speech capabilities in a computer program. To use this API, the package must be installed on the computer using the command ""pip install dialogflow."" Samples are provided for different methods of using the API, including speech input from a file, speech output to a file, and speech input by streaming. These samples can be found on the Google Cloud website."
47,"Part 5 of the document discusses ChatGPT and the OpenAI API. ChatGPT is a chatbot created by OpenAI that uses artificial intelligence to generate human-like conversations. It is trained on a large dataset of text from the internet, making it flexible and able to handle a wide range of topics. The OpenAI API allows developers to access the underlying technology used in ChatGPT and integrate it into their own applications. This section provides instructions on how to use the OpenAI API and gives examples of its capabilities. It also discusses potential ethical concerns surrounding the use of AI chatbots."
48,"The document discusses the launch of ChatGPT, a text generation tool created by OpenAI on November 30, 2022. It is capable of performing various tasks through multi-round conversations and produces high-quality answers. The ChatGPT API was launched on March 1, 2023."
49,"ChatGPT is a project aimed at accelerating digital excellence at the National University of Singapore. The training process for ChatGPT involves using large amounts of data to train the model, which includes pre-processing, tokenization, and fine-tuning. The model is then evaluated using various metrics and can be further improved through continuous training and fine-tuning. This process allows ChatGPT to generate high-quality responses in natural language conversations."
50,"The document discusses the announcement made by OpenAI on September 25, 2023, regarding the release of ChatGPT's voice and image capabilities. This technology, developed by National University of Singapore, aims to accelerate digital excellence by allowing users to generate human-like text and images using artificial intelligence. The capabilities of ChatGPT have the potential to greatly enhance the efficiency and effectiveness of various industries, such as customer service and content creation. This development showcases the continuous advancements in AI technology and its potential to revolutionize various fields."
51,"ChatGPT, a language AI developed by OpenAI, now has the ability to speak and respond to users. This new technology, called Text-to-Speech, can create realistic synthetic voices from just a few seconds of real speech. This opens up possibilities for various creative and accessibility-focused applications."
52,"The National University of Singapore offers OpenAI APIs for accelerating digital excellence. The key concepts of these APIs include prompt, completion, and token. Prompt refers to user input, completion is the text that matches the user input, and token refers to words or chunks of characters. When designing prompts, it is important to give accurate instructions and good examples, or a combination of both. These APIs can help improve digital excellence by providing accurate and efficient text completion."
53,"The National University of Singapore offers a range of OpenAI APIs that can accelerate digital excellence. These include Text Completion, Code Completion, Chat Completion, Image Generation, Fine Tuning, Embeddings, Speech-to-Text, and Moderation. These APIs can perform various tasks such as generating code, improving chat support, converting text into vector representations, recognizing and translating speech, and detecting sensitive or unsafe text. These APIs can be used to enhance digital processes and improve overall efficiency."
54,"To utilize the OpenAI APIs for the National University of Singapore Program with OpenAI, one must first obtain an API key by logging into the OpenAI website and creating a new secret key. This key must then be saved to a file. Next, the SDK must be installed using the command ""pip install openai""."
55,"The Text Completion API offers a variety of features including generation of story ideas, business plans, and marketing slogans. It also allows for conversation with humans and transformation tasks such as translation, conversions, summarization, and completion. The API can also provide factual responses to questions and allows for inserting text with both prefix and suffix. Additionally, it can edit text based on input and instructions."
