Page,Summary
Page 1,NUS-ISS Problem Solving Using Pattern Recognition 2024 National University of Singapore. All rights Reserved. by Nicholas Ho Deep learning:Act .
Page 2,deep learning predicts wind power output 36 hours ahead of actual generation . based on predictions recommend optimal hourly delivery commitments to power grid .
Page 3,•Actual vs PredictedWind power output prediction Better economic value 2024 National University of Singapore.
Page 4,wind power output prediction Better economic value 4 . forecaster predicts a higher wind output . a better wind output prediction is expected to increase .
Page 5,"predict then recommend What's next? 2024 National University of Singapore, singapur ."
Page 6,CNN sees the relations based on distance 2024 National University of Singapore . all rights reserved .
Page 7,http://medium.com/recombee-blog/machine-learning-for-recommender-systems-part-2-deep-rerecommendation-sequence-prediction-
Page 8,fifa-18-to-perfect-the-art-of-free-kicks-f2e4e979ee66 Freekick please .
Page 9,fifa-18-to-perfect-the-art-of-free-kicks-f2e4e979ee66 Deep Reinforcement learning Deep Q-learning 2024 .
Page 10,deep Reinforcement learning Fifa 18 2024 National University of Singapore . all rights reserved.10 deep-q-learning .
Page 11,AI Ryu is played by AI that learned by itself to play 2024 National University of Singapore . all rights reserved.
Page 12,2024 National University of Singapore. All Rights Reserved . 12 1.29 onwards - 12 1.28 .
Page 13,2024 National University of Singapore . all rights reserved.13 1.29 onwards . 1.29 .
Page 14,Grasping Shared learning: Sharing Experience across robots can accelerate learning! 2024 National University of Singapore .
Page 15,mobile robot learning how to navigate while avoiding collisions by itself . 2024 National University of Singapore .
Page 16,mobile robot learning how to navigate while avoiding collisions by itself . 2024 National University of Singapore .
Page 17,2024 National University of Singapore (singapore) Learning how to play soccer by themselves .
Page 18,2024 National University of Singapore. All Rights Reserved [REDACTED_PHONE].
Page 19,"wayve says its cars learn to drive from data with machine learning . every time a safety driver intervenes and takes over, the car learns to drive better ."
Page 20,2024 National University of Singapore. All Rights Reserved . 2024 - the first indriving-a-car .
Page 21,eRwTbRtnT1I Autonomous vehicle Example 1: Wayve; Drive by self-learning together with human feedback
Page 22,Short Practice (30 Mins; 8 Marks Total): Deep Reinforcement Learning for Pick & Place Movements for a Robotic Arm System .
Page 23,machinew wants their robotic arm system to pick and place target objects moving on a conveyor belt in an intelligent manner . RGB-Depth cameras (attached to the robotic arm) are also used to detect the position and trajectory
Page 24,"[1 mark] ii. Identify 3 factors that are needed to be considered for your reward function based on the previously mentioned criteria . the architecture must include the physical robot hardware, the target object, other objects to avoid collision"
Page 25,Quick Exercise: “Act” Use Cases using Deep Learning . 2024 National University of Singapore .
Page 26,you are to list out 1 unique and interesting use case that uses deep learning for action purposes . the only condition is that your input must not be mentioned before in this module so far .
Overall Summary,wind power output prediction Better economic value 2024 National University of Singapore . all rights reserved.6 Source: https://medium.com/recombee-blog/machine-learning-for-recommender- systems-part-2-deep-recommandation-sequence-prediction-automl-f134bc79d66b Recommend based on distance .
